recipe,index,image,text
BREAKFAST QUESADILLAS,6,/images/recipe/breakfast quesadillas/4.png,"In a sauce pan on medium heat add 1/4 cup of milk, 3 eggs, and a pinch of salt. Begin to scramble the eggs to your liking."
BREAKFAST QUESADILLAS,7,/images/recipe/breakfast quesadillas/5.png,"Once the chorizo and eggs are done, place one fresh tortilla in a hot skillet. Top with shredded sharp cheddar, sliced serrano peppers, sliced red onion, hot scrambled eggs, crispy chorizo, and a few sprigs of cilantro. Top with some more cheddar and cap it off with another fresh tortilla."
BREAKFAST QUESADILLAS,8,/images/recipe/breakfast quesadillas/6.png,"Let it heat for a minute or so to give the cheese a chance to melt…then give it a good flip. Once the cheese is fully melted, remove it from the heat, halve or quarter it, and ENJOY!"
HONEY BAKED EGGS BENEDICT,1,/images/recipe/honey baked eggs benedict/image.png,
HONEY BAKED EGGS BENEDICT,2,/images/recipe/honey baked eggs benedict/imgr.png,
HONEY BAKED EGGS BENEDICT,3,/images/recipe/honey baked eggs benedict/1.png,Crack open 2 eggs and separate the yolks from the whites. We only need the yolks for this recipe. Bring 1/2 cup of melted butter to a simmer and slowly incorporate the butter into the yolks while you whisk.
HONEY BAKED EGGS BENEDICT,4,/images/recipe/honey baked eggs benedict/2.png,Continue to vigorously whisk until the mixture is thick enough to coat the back of a spoon. Store in a warm place and set aside until needed.
HONEY BAKED EGGS BENEDICT,5,/images/recipe/honey baked eggs benedict/3.png,"Peel and skin 1 sweet potato and 1 russet potato. I’m using a turning mandolin, but you can use a regular mandolin or simply julienne the potatoes into long thin strands. Fill a small pot 1/3 way up with canola oil and bring it to 350F. Lay out a few paper towels and begin frying a handful of the potato strands mixed together."
HONEY BAKED EGGS BENEDICT,6,/images/recipe/honey baked eggs benedict/4.png,"Fry for about 2 minutes on each side, or until they just begin to turn golden. Let them drain on the paper towels until needed."
HONEY BAKED EGGS BENEDICT,7,/images/recipe/honey baked eggs benedict/5.png,"While those drain, trim the tops of 1 bunch of asparagus. Season with salt, pepper, and a drizzle of olive oil. Transfer to a grill on medium to high heat and grill until they are a vibrant green. Add a few pieces of the honey glazed ham, just to give them some nice grill marks. Remove from heat and set aside until needed."
HONEY BAKED EGGS BENEDICT,8,/images/recipe/honey baked eggs benedict/6.png,"In a medium sauce pot filled three quarters up with water, bring the water to a rolling boil. Add a splash of white wine vinegar and give the water a few mixes. You want the water to be whirling when you lightly drop in 1-3 cracked eggs. Continue the whirling motion of the water for about 30 seconds after you drop in the eggs. Cook for 4-5 minutes for runny yolks, longer for more cooked eggs."
HONEY BAKED EGGS BENEDICT,9,/images/recipe/honey baked eggs benedict/7.png,"Once the eggs are cooked re-heat the hollandaise and season with 2 tsp of lemon juice, 1 tsp of smoked paprika, 1 tsp of cayenne pepper, and salt to taste. Spoon a little bit of the hollandaise sauce onto the plate."
HONEY BAKED EGGS BENEDICT,10,/images/recipe/honey baked eggs benedict/8.png,"Place a crispy potato cake on top of the sauce followed by a couple slices of honey glazed ham, some grilled asparagus, a couple poached eggs, and a hearty drizzle of the hollandaise. Sprinkle with a little bit of cayenne and all that’t left to do is enjoy."
BREAKFAST TOSTADA,1,/images/recipe/breakfast tostada/image.png,
BREAKFAST TOSTADA,2,/images/recipe/breakfast tostada/ingr.png,
BREAKFAST TOSTADA,3,/images/recipe/breakfast tostada/1.png,"Start by making homemade refried beans from scratch. Add 1 tbsp of canola oil to a small sauce pot on high heat. Toss in 1/4 onion, 1 split garlic clove, and pinch of cumin. Give this a stir and cook for about 2-3 minutes before adding 1/4 cup of hydrated pinto beans (hydrated for at least 2-3 hours before cooking) and let cook for 1 1/2 hours, or until the beans are very tender."
BREAKFAST TOSTADA,4,/images/recipe/breakfast tostada/2.png,"Once the beans are done cooking, transfer them to a food processor and blend on high speed for at least 5 minutes, or until the mixture is as fine as possible. Transfer the refried beans back into the sauce pan and let sit at low heat while you prep the rest of the meal, stirring occasionally."
BREAKFAST TOSTADA,5,/images/recipe/breakfast tostada/3.png,"Slice up 1/2 a jalepeno and add it to a bowl along with a 1/4 red onion, and some roughly picked cilantro leaves. Set aside."
BREAKFAST TOSTADA,6,/images/recipe/breakfast tostada/4.png,"On medium to high heat, add a splash of canola oil to a pan and crisp up a few corn tortillas. Cook for two minutes on each side, or until they are a light golden brown."
BREAKFAST TOSTADA,7,/images/recipe/breakfast tostada/5.png,Begin plating by adding a dollop of the refried beans to a serving plate and topping that with a crispy corn tortilla.
BREAKFAST TOSTADA,8,/images/recipe/breakfast tostada/6.png,"Quickly fry up an egg on medium to high heat, cook to your liking (I prefer 2-3 minutes)."
BREAKFAST TOSTADA,9,/images/recipe/breakfast tostada/7.png,"Once the egg is ready to go, add a few dollops of refried beans to the top of the crispy corn tortilla, followed by the fried egg. Toss the veggie melody with a squeeze of lime and a pinch of salt before adding a small handful to the top of the tostada. Season with a pinch of salt, pepper, chili powder, and ENJOY!"
CRISPY EGGS BENEDICT,1,/images/recipe/crispy eggs benedict/image.png,
CRISPY EGGS BENEDICT,2,/images/recipe/crispy eggs benedict/imgr.png,
CRISPY EGGS BENEDICT,3,/images/recipe/crispy eggs benedict/1.png,"Start by making the Avocado spread. Add the meat of 1 ripe avocado to a small mixing bowl. Add 2 tsp of chopped parsley, the juice of 1 small lemon, salt to taste, 1 tsp ground cumin, 1 tsp chili flakes, and 2 tbsp olive oil. Give this a quick mash/mix and set aside."
CRISPY EGGS BENEDICT,4,/images/recipe/crispy eggs benedict/2.png,"Begin making the hollandaise sauce by adding 1 egg yolk to a small sauce pan. Begin whisking the yolk. As you continue to whisk, slowly add in half of the melted butter (1/4 cup) just a drizzle at a time. Do not add all the butter at once and be sure to continue whisking throughout the process; otherwise you risk the whole sauce being broken."
CRISPY EGGS BENEDICT,5,/images/recipe/crispy eggs benedict/3.png,"While continuing to whisk, return the pot to medium heat for one minute. Remove from heat and slowly add in the remainder of the melted butter, continuing whisking until the sauce generously coats the back of a spoon."
CRISPY EGGS BENEDICT,6,/images/recipe/crispy eggs benedict/4.png,"Once you’ve reached the desired consistency, return the pot to medium heat and allow the sauce to set up for 1 minute while continuing to whisk. Remove from heat and add 1 squeeze of lemon, 2 tsp chili powder, and salt to taste. Give this a quick mix and set aside."
CRISPY EGGS BENEDICT,7,/images/recipe/crispy eggs benedict/5.png,"Next up halve 1 bunch of asparagus lengthwise. Season the asparagus, and 1 thick slice of sour dough bread, with a drizzle of olive oil, salt, and pepper to taste."
CRISPY EGGS BENEDICT,8,/images/recipe/crispy eggs benedict/6.png,"Transfer the bread and asparagus to a grill top on medium to high heat. Grill both sides of the bread and asparagus for about 1-2 minutes, or until both sides are cooked perfectly."
CRISPY EGGS BENEDICT,9,/images/recipe/crispy eggs benedict/7.png,"Once everything is nice and toasted, remove the bread from the grill and top with a generous smear of the avocado spread. Top that with the grilled asparagus."
CRISPY EGGS BENEDICT,10,/images/recipe/crispy eggs benedict/8.png,"Lastly, cook two crispy eggs for about 3-4 minutes. You can find the full recipe for crispy eggs."
CRISPY EGGS BENEDICT,11,/images/recipe/crispy eggs benedict/9.png,"When the eggs are done cooking, remove them from the heat and gently blot off any excess grease with a paper towel. Add them to the top of the avocado toast."
CRISPY EGGS BENEDICT,12,/images/recipe/crispy eggs benedict/10.png,"Top it all off with a couple generous spoon fulls of the homemade Hollandaise Sauce, a few leaves of parsley, and a sprinkle of chili powder. Enjoy!"
BLUEBERRY PANCAKES,1,/images/recipe/blueberry pancakes/image.png,
BLUEBERRY PANCAKES,2,/images/recipe/blueberry pancakes/ingr.png,
BLUEBERRY PANCAKES,3,/images/recipe/blueberry pancakes/1.png,"Start by adding the dry ingredients into a large mixing bowl. Add 1 cup all purpose flour, 2 tbsp white granulated sugar, 1 tsp salt, 1 tsp baking powder, 1 tsp baking soda, and 1/2 of a skinned vanilla bean. Finish it off with the zest of half a lemon. Give the dry mix a good whisk, before adding the wet ingredients."
BLUEBERRY PANCAKES,4,/images/recipe/blueberry pancakes/2.png,"Next add 1 egg, 1 cup whole milk (may need less or extra depending on consistency), and 3 tbsp melted butter. Whisk for 2-3 mins, or just until the lumps are smoothed out."
BLUEBERRY PANCAKES,5,/images/recipe/blueberry pancakes/3.png,"Add in 3/4 cup blueberries. Give this a few mashes to open up the berries slightly, and then mix into the batter."
BLUEBERRY PANCAKES,6,/images/recipe/blueberry pancakes/4.png,Grease a skillet on high heat with a small amount of oil or butter. Ladle in the blueberry pancake batter. You can make these any size you like. Cook on each side until they are a nice golden brown. Repeat process for desired amount of pancakes.
BLUEBERRY PANCAKES,7,/images/recipe/blueberry pancakes/5.png,"I topped my short stake with a few pads of butter and a simple blueberry compote—made by reducing 1 cup blueberries, 1/2 cup rum, 1 cup water, and 1/2 cup sugar in a small sauce pan over medium heat. Cook until the blueberries become nice and syrupy."
BLUEBERRY PANCAKES,8,/images/recipe/blueberry pancakes/6.png,Top that with some reduce maple syrup—made my reducing 1 cup maple syrup on high heat for 7 minutes. Enjoy!
"EGGS, BACON, & HASH POTATOES",1,/images/recipe/eggs bacon and hash potatoes/image.png,
"EGGS, BACON, & HASH POTATOES",2,/images/recipe/eggs bacon and hash potatoes/ingr.png,
"EGGS, BACON, & HASH POTATOES",3,/images/recipe/eggs bacon and hash potatoes/1.png,"Dice up about a 1/2 cup of applewood smoked bacon and drop it into a sauté pan on medium heat. Crisp the bacon for about 5-7 minutes,or until it's nice and dark with a crispy exterior."
"EGGS, BACON, & HASH POTATOES",4,/images/recipe/eggs bacon and hash potatoes/2.png,"Add 1 small white onion, sliced. Allow to caramelize for several minutes."
"EGGS, BACON, & HASH POTATOES",5,/images/recipe/eggs bacon and hash potatoes/3.png,"Once the onions are caramelized, add 2 cups diced par-boiled potatoes. Add a little pepper to taste and combine. Cook for 3-4 minutes and remove from heat, set aside."
"EGGS, BACON, & HASH POTATOES",6,/images/recipe/eggs bacon and hash potatoes/4.png,"Add a little canola oil to a non-stick pan on medium heat and gently crack a fresh egg over the center of the pan.  You want to keep the egg yolk centered and let the whites surround it. Cook for 2-3 minutes, or until the yolk it almost custard-like."
"EGGS, BACON, & HASH POTATOES",7,/images/recipe/eggs bacon and hash potatoes/5.png,Carefully transfer the egg to a plate.
"EGGS, BACON, & HASH POTATOES",8,/images/recipe/eggs bacon and hash potatoes/6.png,"Transfer the potatoes back onto high heat this time. Add 1 tsp picked thyme, 1 tbsp torn parsley, salt and pepper, and 1 tbsp sherry vinegar. Let this get nice and hot, then you're ready to plate."
"EGGS, BACON, & HASH POTATOES",9,/images/recipe/eggs bacon and hash potatoes/7.png,"Plate the potatoes around the edge of the yolk. Add a little salt and pepper to taste, a tbsp of slice chives, and ENJOY!"
MY BREAKFAST BURRITO,1,/images/recipe/my breakfast burrito/image.png,
MY BREAKFAST BURRITO,2,/images/recipe/my breakfast burrito/ingr.png,
MY BREAKFAST BURRITO,3,/images/recipe/my breakfast burrito/1.png,"In a medium nonstick sauté pan on high heat, cook 1/2 lb of spicy italian sausage for 10 minutes until crispy."
MY BREAKFAST BURRITO,4,/images/recipe/my breakfast burrito/2.png,"In a separate nonstick medium sauté pan on high heat, add a few Tbsps of canola oil, 1 cup of diced par-boiled yukon gold potatoes, a pinch of salt, 1 tsp smoked paprika, 1 tsp cayenne pepper, and 1 tsp ground cumin. Cook until crispy and golden brown."
MY BREAKFAST BURRITO,5,/images/recipe/my breakfast burrito/3.png,"In another nonstick sauté pan on medium heat, add 2 Tbsps of canola oil or butter and add 3-4 whole eggs to the pan. Cooks the eggs for 3-4 minutes until thoroughly scrambled."
MY BREAKFAST BURRITO,6,/images/recipe/my breakfast burrito/4.png,"Add the crispy sausage, seasoned potatoes, scrambled eggs, crisps applewood smoked bacon, roasted green chilies (or canned chillies), pico de gallo (tomatoes, onions, cilantro, jalapeños, lime), and a some shredded cheese to a medium-large flour tortilla."
MY BREAKFAST BURRITO,7,/images/recipe/my breakfast burrito/5.png,Fold the edges inward and roll the tortilla around the filling.
MY BREAKFAST BURRITO,8,/images/recipe/my breakfast burrito/6.png,Get a cast iron grill on high heat and place the folded burrito on the grill with the seem facing down.
MY BREAKFAST BURRITO,9,/images/recipe/my breakfast burrito/7.png,Grill on both sides for 3-4 minutes until slightly crispy and it has a few grill marks then ENJOY!!!
CRISPY CAULIFLOWER,1,/images/recipe/crispy cauliflower/image.png,
CRISPY CAULIFLOWER,2,/images/recipe/crispy cauliflower/ingr.png,
CRISPY CAULIFLOWER,3,/images/recipe/crispy cauliflower/1.png,"Begin by washing, de-stemming, and cutting half a head of cauliflower into bite-size florets—and trimming the ends."
CRISPY CAULIFLOWER,4,/images/recipe/crispy cauliflower/2.png,"In a separate bowl, add 1 cup of flour, 1 tbsp of baking soda, 1 tbsp of salt, 3/4 cup of beer, 1 tbsp of lemon, and mix until ingredients are well combined."
CRISPY CAULIFLOWER,5,/images/recipe/crispy cauliflower/3.png,Toss in a handful of cauliflower florets and using a slotted spoon drain off the excess batter before carefully dropping the battered cauliflower into a pan of hot oil (375°F).
CRISPY CAULIFLOWER,6,/images/recipe/crispy cauliflower/4.png,"Fry until golden brown, transfer to baking sheet/cooling rack to strain the excess grease, and repeat. Once all of the florets have been fried, transfer to the oven and bake at 375°F for an additional 10-15 minutes."
CRISPY CAULIFLOWER,7,/images/recipe/crispy cauliflower/5.png,"In a small sauce pot on medium to low heat, add in 3 tbsp of fresh lemon juice, 1/4 cup of honey, 1 tbsp of brown sugar, 1 tbsp of apple cider vinegar, 1 tsp of garlic powder, 1 tsp of red pepper, 1 tsp of chopped lemon zest, a pinch of salt, and 1 tbsp of cornstarch (optional: reducing for longer will achieve the same result of thickening the glaze). Mix well and reduce until it becomes a sticky syrup."
CRISPY CAULIFLOWER,8,/images/recipe/crispy cauliflower/6.png,Once the cauliflower is finished baking transfer it to a large metal bowl and coat in the honey lemon glaze. Add a pinch of fresh thyme and lemon zest. Give a few tosses and transfer to a serving dish.
CRISPY CAULIFLOWER,9,/images/recipe/crispy cauliflower/7.png,I went with a paper cup lined with wax paper for that fair-foods vibe! Top with another pinch of thyme and lemon zest—all that’s left to do is ENJOY!
THE CRISPY POTATO STACK,1,/images/recipe/the crispy potato stack/image.png,
THE CRISPY POTATO STACK,2,/images/recipe/the crispy potato stack/ingr.png,
THE CRISPY POTATO STACK,3,/images/recipe/the crispy potato stack/1.png,"Start by squaring off the edges of 1 large russet potato. Using a mandolin, or knife, carefully slice the potato into long slender pieces. You want to achieve the thickness of a credit card or so."
THE CRISPY POTATO STACK,4,/images/recipe/the crispy potato stack/2.png,"Stack the potato slices as evenly as possible and then trim the edges to make an even rectangular shape. Cut the rectangle in half, press the slices firmly together, and shingle them into a stair-like structure."
THE CRISPY POTATO STACK,5,/images/recipe/the crispy potato stack/3.png,"Transfer to a frying pan filled with canalo oil heated to 325°F. Fry for about 4-5 minutes, or until a crispy golden brown, flipping throughout."
THE CRISPY POTATO STACK,6,/images/recipe/the crispy potato stack/4.png,Transfer to a paper towel to drain. Sprinkle with a little sea salt and ENJOY!
TATER TOTS,1,/images/recipe/tater tots/image.png,
TATER TOTS,2,/images/recipe/tater tots/ingr.png,
TATER TOTS,3,/images/recipe/tater tots/1.png,Start by heavily salting two Idaho Potatoes.
TATER TOTS,4,/images/recipe/tater tots/2.png,Wrap them in foil. Bake the potatoes for 1 hour at 400ºF.
TATER TOTS,5,/images/recipe/tater tots/3.png,"Remove the potatoes from the oven when they are fork tender. Let cool before pealing the skin completely off each potato. Once peeled, grate the potato using the largest setting on your box grater. Transfer shreds to a large mixing bowl."
TATER TOTS,6,/images/recipe/tater tots/4.png,"In a small saute pan on medium heat add 1/2 cup of butter to melt, 1 tbsp of chopped parsley, 1 tbsp of thyme, and 1 tbsp of rosemary. Let the mixture saute for about 2-3 minutes. You want the butter to be infused with the herbs, but NOT browned."
TATER TOTS,7,/images/recipe/tater tots/5.png,Add the melt butter medley to the grated potato. Add salt and pepper for taste and 3 tbsp of all-purpose flour. Mix until all ingredients are throughly combined.
TATER TOTS,8,/images/recipe/tater tots/6.png,"Next use a small ring cutter, or any tool shaped similarly, to mold the potato herb mixture into that classic tater tot shape. Once all of the tater tots are molded, dust them with all-purpose flour. You want to ensure that each side of the tater tot is dusted."
TATER TOTS,9,/images/recipe/tater tots/7.png,"Bring a medium sauce pan, filled half-way with canola oil, to 375ºF."
TATER TOTS,10,/images/recipe/tater tots/8.png,"Fry the tater tots for about 5-6 minutes, or until they are a nice golden brown. Once cooked, remove from the oil and let them drain on paper towels."
TATER TOTS,11,/images/recipe/tater tots/9.png,"When you are ready to plate, simply give the tater tots a sprinkle of salt, pair with your favorite dipping sauce, and ENJOY!"
GREEN BEANS ALMONDINE,1,/images/recipe/green beans almondine/image.png,
GREEN BEANS ALMONDINE,2,/images/recipe/green beans almondine/ingr.png,
GREEN BEANS ALMONDINE,3,/images/recipe/green beans almondine/1.png,"Fill a medium stock pot with water and bring to a rolling boil. Add two generous pinches of salt to the water. Clean and cut the stems off of the green beans and add them to the boiling water. Blanche them for approximately 3-5 minutes until they turn bright green and tender. They should still have a little bite to them. Quickly take them out of the boiling water, strain, and put them into an ice-water bath or rinse them under cold water until they’re completely cooled down."
GREEN BEANS ALMONDINE,4,/images/recipe/green beans almondine/2.png,"In a medium sauté pan on low heat add the butter, green beans, salt & pepper, and a little water."
GREEN BEANS ALMONDINE,5,/images/recipe/green beans almondine/3.png,Warm the green beans until they’re coated with the butter.
GREEN BEANS ALMONDINE,6,/images/recipe/green beans almondine/4.png,In a different small sauté pan on medium heat add the rest of the butter until in is lightly browned. Quickly add the almonds while mixing with a spoon so that the almonds on the outer edge don’t burn. Toast the almonds until they turn a light golden brown.
GREEN BEANS ALMONDINE,7,/images/recipe/green beans almondine/5.png,Put the buttered green beans into a serving dish and generously top them with the toasted almonds and brown butter.
PASSION FRUIT GRANITA,1,/images/recipe/passion fruit granita/image.png,
PASSION FRUIT GRANITA,2,/images/recipe/passion fruit granita/ingr.png,
PASSION FRUIT GRANITA,3,/images/recipe/passion fruit granita/1.png,"In a mixing bowl at in 1 cup passion fruit juice (alternatives: 1/4 cup fresh passion fruit pulp or 1/2 cup passion fruit puree) along with 2 cups of water, 1 tbsp yuzu juice, and 2 tbsp sugar. Give this a good whisk and freeze for about 3-4 hours."
PASSION FRUIT GRANITA,4,/images/recipe/passion fruit granita/2.png,"In the meantime go ahead thinly slice a lemon. Lay those slices onto a sheet tray, dust with cayenne pepper and chile powder, and sprinkle with sugar."
PASSION FRUIT GRANITA,5,/images/recipe/passion fruit granita/3.png,Cover with and additional silpat and bake at 350ºF for 25 minutes.
PASSION FRUIT GRANITA,6,/images/recipe/passion fruit granita/4.png,"Once the lemons have finished baking, remove them from the oven and let them cool for 5-7 minutes. Remove from the silpat and set aside until you’re ready to garnish."
PASSION FRUIT GRANITA,7,/images/recipe/passion fruit granita/5.png,"Once the passion fruit mixture has set up, remove it from the freezer and begin scraping at it with a fork."
PASSION FRUIT GRANITA,8,/images/recipe/passion fruit granita/6.png,"Once it is nice a shredded, add a generous portion to a chilled glass. Add a splash of chilled sake and garnish with a sliced if spicy candied lemon. Enjoy!"
APPLE-WHISKEY DONUTS (VEGAN),1,/images/recipe/apple whiskey donuts/image.png,
APPLE-WHISKEY DONUTS (VEGAN),2,/images/recipe/apple whiskey donuts/ingr.png,
APPLE-WHISKEY DONUTS (VEGAN),3,/images/recipe/apple whiskey donuts/1.png,"Start by skinning and coring 3 honey crisp apples (about 1 1/2 cups). Drizzle some olive oil in pan heated on high. Add the diced apples, 1/4 cup of white and dark brown sugar (equal ratios), pinch of salt, and 2 tbsp of whiskey. Reduce apples and whisky for about 10 minutes, or until they a dark golden brown—stir throughout reducing."
APPLE-WHISKEY DONUTS (VEGAN),4,/images/recipe/apple whiskey donuts/2.png,"Once reduced, transfer to a blender or food processor."
APPLE-WHISKEY DONUTS (VEGAN),5,/images/recipe/apple whiskey donuts/3.png,"In that same pan (with the apple reduction leftover goodness) reduce heat to low, add 2 tbsp of whiskey and 1/2 cup of apple juice. Reduce to a syrup."
APPLE-WHISKEY DONUTS (VEGAN),6,/images/recipe/apple whiskey donuts/4.png,"While that reduces, blend the roasted whiskey apples into a very fine puree."
APPLE-WHISKEY DONUTS (VEGAN),7,/images/recipe/apple whiskey donuts/5.png,"In a separate bowl, add 3/4 cup of almond milk (or alternative), 1 tsp of nutmeg,1 tsp of cinnamon,1 tsp of allspice, 3 tbsp of canola oil, 3 tbsp brown sugar, 3 tbsp granulated sugar, 1 tsp salt, 1 cup flour, and 1 tbsp of baking powder. Give it a good mix and then add the roasted apple puree. Mix well and transfer to a piping bag."
APPLE-WHISKEY DONUTS (VEGAN),8,/images/recipe/apple whiskey donuts/6.png,"Using a greased up mini donut pan, pipe in the doughnut batter until each mold is filled about halfway. REPEAT until all molds are filled. Bake at 375ºF for 15 minutes, or until they are a dark golden brown."
APPLE-WHISKEY DONUTS (VEGAN),9,/images/recipe/apple whiskey donuts/7.png,"While those bake, begin making the glazes. Add 1 tbsp of the reduced whisky syrup to 4-5 tbsp of powdered sugar. Mix well. In a separate bowl add 4-5 tbsp of powdered sugar and 1 tsp of nutmeg, cinnamon, and allspice. Mix well. Lastly, in another bowl add 4-5 tbsp of granulated sugar and 1 tsp of nutmeg, cinnamon, and allspice. Mix well."
APPLE-WHISKEY DONUTS (VEGAN),10,/images/recipe/apple whiskey donuts/8.png,"Once the donuts are gold and crispy, remove then from the oven and carefully flip them over and onto a cooling rack until they are cool enough to handle."
APPLE-WHISKEY DONUTS (VEGAN),11,/images/recipe/apple whiskey donuts/9.png,"All that's left to do is starting coating the mini spiced donuts. I did equal amounts of spiced sugar, spiced powdered, and lastly the apple-whisky glaze. Dip, flip, and ENJOY!"
"CANNOLI BITES (MATCHA, DARK CHOCOLATE, VANILLA)",1,/images/recipe/cannoli bites/image.png,
"CANNOLI BITES (MATCHA, DARK CHOCOLATE, VANILLA)",2,/images/recipe/cannoli bites/ingr.png,
"CANNOLI BITES (MATCHA, DARK CHOCOLATE, VANILLA)",3,/images/recipe/cannoli bites/1.png,"In a small food processor add 1 cup of all purpose flour, 1/4 cup of sugar, 1/4 cup of butter, and 1 tsp of salt. Blend until it reaches a mealy texture. Then add in 2 egg yolks, 3 tbsp of brandy (or dark rum), and 4 tbsp of water. Blend until the texture of the dough is slightly tacky."
"CANNOLI BITES (MATCHA, DARK CHOCOLATE, VANILLA)",4,/images/recipe/cannoli bites/2.png,"Remove the dough from the food processor and kneed it for 2-3 minutes, or until it begins to stiffen. Wrap in plastic and let chill for 15 minutes. Once chilled, remove from the fridge and roll it out into 1/4” thick sheets. Half the dough so that it will fit inside of the pasta maker."
"CANNOLI BITES (MATCHA, DARK CHOCOLATE, VANILLA)",5,/images/recipe/cannoli bites/3.png,"Starting on a thicker setting, begin running the dough through the pasta maker until it has reached the thickness of a credit card. Divide the dough into manageable sheets and trim it down to 1 1/2” strips."
"CANNOLI BITES (MATCHA, DARK CHOCOLATE, VANILLA)",6,/images/recipe/cannoli bites/4.png,"Using a cannoli mold, roll the dough all the way around (slightly over lapping the other side), trim the excess, and seal with a little water on the edge of your finger."
"CANNOLI BITES (MATCHA, DARK CHOCOLATE, VANILLA)",7,/images/recipe/cannoli bites/5.png,"Using canola oil, carefully fry cannoli shells for 2-3 minutes, or until they are golden brown on all sides. Repeat the process until the dough has all been used."
