recipe,index,image,text
"CANNOLI BITES (MATCHA, DARK CHOCOLATE, VANILLA)",8,/images/recipe/cannoli bites/6.png,"These can be filled with just about anything! I decided to whip up 1 cup of cream with 1/2 cup of sugar until it had stiff peaks. Divided that into thirds added 4 tbsp of cocoa powder to one, 2 tbsp of matcha powder to another, and 2 tbsp of vanilla paste to the last...fold...pastry bag...done!"
"CANNOLI BITES (MATCHA, DARK CHOCOLATE, VANILLA)",9,/images/recipe/cannoli bites/7.png,Pipe the filling into the cannoli shells and ENJOY!
SMORE TART,1,/images/recipe/smore tart/image.png,
SMORE TART,2,/images/recipe/smore tart/ingr.png,
SMORE TART,3,/images/recipe/smore tart/1.png,"Begin making the spice tart dough by adding 1 cup of flour, 1/4 cup of sugar, 1 egg yolk, 3 tbsp of cream, 1/4 cup of cold dice butter, 1 tsp of salt, and 1 tsp each of ground cinnamon, clove, and nutmeg into a food processor. Blend the ingredients until they form one mass of dough."
SMORE TART,4,/images/recipe/smore tart/2.png,"After the dough’s come together, remove it from the food processor, form a ball, wrap in plastic, and transfer to the fridge to chill for 30 minutes."
SMORE TART,5,/images/recipe/smore tart/3.png,"Once the dough is chilled, dust a work surface with flour, and begin rolling the dough until it reaches 1/4” in thickness. Using a 4” ring cutter, cut out as many circles as possible for the s’more tart base."
SMORE TART,6,/images/recipe/smore tart/4.png,Transfer the rounds to a lined baking sheet. Using the top of a mason jar lid (or alternative) gently press it into the dough to create an indentation for the filling. Bake at 350ºF for 20 minutes or until they are a solid brown color.
SMORE TART,7,/images/recipe/smore tart/5.png,"While the tart shells are baking, begin making the dark chocolate custard. Over a double broiler, stir together 1/4 cup of milk, 3 tbsp of sugar, and 2 tsp of cornstarch. Continue mixing until the sugar has dissolved."
SMORE TART,8,/images/recipe/smore tart/6.png,"Then add in 1/2 cup of dark chocolate and allow it to melt into the mixture while gently stirring. In a separate bowl with two egg yolks, temper in a few table spoons of the chocolate mixture before adding the yolks to the double broiler. Allow the mixture to reach 175ºF while continuing to stir."
SMORE TART,9,/images/recipe/smore tart/7.png,"Once the custard is cooked, remove it from the heat, cover in plastic, and allow to cool in the fridge for at least 1 hour."
SMORE TART,10,/images/recipe/smore tart/8.png,"Once the tart shells are finished, allow to cool for at least 15 minutes. Once the tarts are cool to the touch, transfer the chilled chocolate custard to a piping bag. Pipe a few tablespoons of the custard into the spice tarts. Smooth out with a piping spatula and transfer to the fridge while making the meringue to top. Bring a pot of equal parts sugar and water (1 cup water and 1 cup sugar) to 200ºF. In a separate bowl whip up 3 egg whites. As the egg whites begin to peak, slowly add in the hot syrup a little at a time, while continuing to whisk. Whisk until the peaks become soft and shiny. Transfer to a piping bag and gently pipe the meringue over the chocolate custard topped tarts."
SMORE TART,11,/images/recipe/smore tart/9.png,Use the back of a metal spatula to make little licks (soft peaks) on the top of the custard for a fun texture.
SMORE TART,12,/images/recipe/smore tart/10.png,"To finish, use a kitchen torch (or broiler) and carefully roast the top of the meringue until golden brown. Sprinkle with graham cracker crumbles."
SMORE TART,13,/images/recipe/smore tart/11.png,ENJOY!
PASSION FRUIT CHEESECAKE,1,/images/recipe/passion fruit cheesecake/image.png,
PASSION FRUIT CHEESECAKE,2,/images/recipe/passion fruit cheesecake/ingr.png,
PASSION FRUIT CHEESECAKE,3,/images/recipe/passion fruit cheesecake/1.png,Split and deseed the passion fruit into a separate bowl.
PASSION FRUIT CHEESECAKE,4,/images/recipe/passion fruit cheesecake/2.png,"Next add 1/4 cup of cold diced butter to a food processor along with 1/4 cup of sugar, 1/2 cup of flour, 1 tsp of salt, and 1 tbsp of passion fruit juice (or water). Blend until the ingredients loosely come together (similar to damp sand)."
PASSION FRUIT CHEESECAKE,5,/images/recipe/passion fruit cheesecake/3.png,"Transfer to a baking tray and bake for 20 minutes at 350°F, or until golden brown. When finished cooking, remove from the oven and set aside to cool."
PASSION FRUIT CHEESECAKE,6,/images/recipe/passion fruit cheesecake/4.png,"Begin making the cheesecake filling by adding 3 tbsp of sour cream, 1/2 cup of cream cheese, 1 whole egg, 1/4 cup of sugar, 1 tbsp of cornstarch, and 3-4 tbsp passion fruit juice to a large mixing bowl. Give this a good mix until silky smooth and then set aside to form the cheesecake crust."
PASSION FRUIT CHEESECAKE,7,/images/recipe/passion fruit cheesecake/5.png,Add the crispy crumble to a food processor as well as 2 tbsp of cold diced butter and 2 tbsp of sugar. Pulse several times until the mixture is like a sandy clay.
PASSION FRUIT CHEESECAKE,8,/images/recipe/passion fruit cheesecake/6.png,"Using a springform pan, or closest alternative, form the pie crust by packing the mixture in and around the edges of the pan using your fingers. Be sure to firmly pack in the crust to ensure it doesn’t crumble (TIP: Add an egg yolk to the crumble if you need more moisture or flour to make it more dry). Bake at 350°F for 20-25 minutes, or until golden brown."
PASSION FRUIT CHEESECAKE,9,/images/recipe/passion fruit cheesecake/7.png,"When the crust is finished baking, remove it from the oven and let it cool down for 20-25 minutes. Slowly pour in the cheesecake mixture until it reaches the very top of the crust. Transfer to the top rack of the oven to bake at 300F for an additional 45 minutes."
PASSION FRUIT CHEESECAKE,10,/images/recipe/passion fruit cheesecake/8.png,"Add a baking pan of water to the lower rack of the oven to avoid burning the top of the cheesecake. Once the cheesecake has finished baking, allow to cool at room temperature for at least 1 hour before transferring to the fridge to chill and set up."
PASSION FRUIT CHEESECAKE,11,/images/recipe/passion fruit cheesecake/9.png,"With the cheesecake cooled, carefully remove it from the mold. You can use an offset spatula or butter knife to lift it from the pan if need be. Serve as a personal cake or slice it up to share. Drizzle with some fresh passion fruit syrup and ENJOY!"
BANANA BREAD ICE CREAM SANDWICH,1,/images/recipe/banana bread ice cream sandwich/image.png,
BANANA BREAD ICE CREAM SANDWICH,2,/images/recipe/banana bread ice cream sandwich/ingr.png,
BANANA BREAD ICE CREAM SANDWICH,3,/images/recipe/banana bread ice cream sandwich/1.png,"Begin making the banana bread by combing 2 whole eggs, 3/4 cup of granulated sugar, 3/4 cup of brown sugar, 2 tsp of salt, and give this a good whisk. Next add in 1 cup of milk, 1 tbsp of vanilla paste (or extract), and 1/4 cup of melted butter. Continue whisking for another 2 minutes, or until well combined. Once thoroughly mixed, add in 1 tbsp of baking soda, 1 1/2 cups of all purpose flour, and 2-3 ripe bananas. Begin mashing in the bananas and bring to a stir. Whisk until you have a thick batter, but do not over whisk and cause the dough to be tough."
BANANA BREAD ICE CREAM SANDWICH,4,/images/recipe/banana bread ice cream sandwich/2.png,"Transfer the banana bread batter to a loaf tray that has the bottom lined with parchment. Fill the pan 2/3 the way up. Bake at 350°F for 25-30 minutes, or until golden brown and cooked through."
BANANA BREAD ICE CREAM SANDWICH,5,/images/recipe/banana bread ice cream sandwich/3.png,"You can toss together a quick crumble like I did by combing flour, a few pads of butter, and cinnamon sugar. Use your hands to combine until is begins to crumble. Toss it on a baking sheet and bake for 15 minutes at 350°F."
BANANA BREAD ICE CREAM SANDWICH,6,/images/recipe/banana bread ice cream sandwich/4.png,"Whip up a quick brown butter semifreddo ice cream by combining 2 cups of heavy cream, 1/2 cup of honey, and 2 tbsp of vanilla paste (or extract). Fully whip before adding in 1/2 cup of melted brown butter. Continue to whip until well combined and fully whipped."
BANANA BREAD ICE CREAM SANDWICH,7,/images/recipe/banana bread ice cream sandwich/5.png,Transfer to a loaf pan line with parchment paper so that the slices are the same size as the bread. Smooth out the whipped cream and freeze for 2-3 hours before slicing.
BANANA BREAD ICE CREAM SANDWICH,8,/images/recipe/banana bread ice cream sandwich/6.png,"When the banana bread is cool enough to handle, remove it from the pan and cut into fairly thick slices. Take two slices and top them with a praline spread. It’s simply made by combing 2 tbsp of hot water, 1/2 cup of brown sugar, and 1/2 cup of peanut butter."
BANANA BREAD ICE CREAM SANDWICH,9,/images/recipe/banana bread ice cream sandwich/7.png,"Top with a slice of the brown butter semifreddo ice cream, and sandwich it in-between the banana bread slices. Give is a good roll in the crumbles."
BANANA BREAD ICE CREAM SANDWICH,10,/images/recipe/banana bread ice cream sandwich/8.png,ENJOY!
